,Resume_Name,SKI
0,hiring_manager_review1 (dragged) 3.pdf,"SKILLS;Salesforce.com certified Administrator and Advanced Administrator. Well versed in Salesforce.com best practices:;specializing in Sales & Account Management.;Expert InsightSquared administrator;Expert DedsionLink administrator;Profident in Quip, Zendesk, Pivotal Tracker, Gainsight, Microsoft Office Suite, and Google Apps for Business;Certified completion of :World Class Sales Engagement Training: from the Shapiro Negotiations Institute;Trained in CEB:s :Challenger Sale: Methodology"
0,hiring_manager_review1 (dragged) 5.pdf,"SKILLS;Other Experience:;Computervision : Sales and Services increasing responsibilities over 12 years :acquired by PTC:;Gerber Systems Technology : Worldwide CAD Implementation Engineer;United States Coast Guard Academy : Managed Academic Engineering Computer Center;University of Connecticut : Research Center:Roper Public Opinion;e Enterprise :PLM, CAD, e Large scale sales pursuits :: Business Transformation;MES: Solutions e Sales operations e Project Management;e Leading Global teams e Structured salesmethods Impact to complex clients;e Alliance Partnerships : Opportunity identification e Creating new technology;e Product innovation solutions"
0,hiring_manager_review1 (dragged) 6.pdf,Core Competencies:;Y Project Management Y : Cross:Functional leadership : Supply Chain;Y Project Planning : Execution v:: Technology Strategy v Tax platforms
0,hiring_manager_review1 (dragged) 9.pdf,KEY SKILLS;Engagement Management Data Science Advance Analytics;Program Management Tech Pre:Sales Digital Transformation;Agile Transformation Cloud:DevOps Global Delivery;Data Governance Big Data IOT:Al:Machine Learning
0,hiring_manager_review1 (dragged) 13.pdf,":BluePrism, Automation Anywhere, UiPath, WorkFusion, Pega:, AI: :ML, NLP:, AI: :Microsoft;:Tableau, Alteryx:, Other: :Virtual Agents, AWS, MDM:"
